{
  "schema": "design-arc.graph/v1",
  "project_id": "project-alpha",
  "review_id": "review-001",
  "nodes": [
    {
      "id": "node-1",
      "type": "confirmed_objective",
      "label": "First objective"
    },
    {
      "id": "node-1",
      "type": "evidence_source",
      "label": "Duplicate evidence"
    }
  ],
  "edges": []
}
